{
  "jobId": "808ce1b8-24da-4a4e-81eb-1b16b100078b",
  "agent": "researcher",
  "task": "What are the main benefits of renewable energy in 2024? List 3 key advantages with citations.",
  "config": {
    "depth": 5,
    "timeBudget": 120,
    "focus": "balanced",
    "antiHallucination": "high",
    "citationRequired": true,
    "ed2551Mode": true,
    "maxIterations": 10,
    "verificationThreshold": 0.9
  },
  "result": "\nğŸ” Provider Selection Debug:\n  Provider flag: anthropic\n  Model: claude-sonnet-4-20250514\n  Use ONNX: false\n  Use OpenRouter: false\n  Use Gemini: false\n  Use Requesty: false\n  OPENROUTER_API_KEY: âœ“ set\n  GOOGLE_GEMINI_API_KEY: âœ“ set\n  REQUESTY_API_KEY: âœ“ set\n  ANTHROPIC_API_KEY: âœ“ set\n\nğŸš€ Using direct Anthropic API...\n\n\nğŸ¤– Agent: researcher\nğŸ“ Description: Deep research and information gathering specialist\n\nğŸ¯ Task: What are the main benefits of renewable energy in 2024? List 3 key advantages with citations.\n\n**ADVANCED RESEARCH PARAMETERS:**\n\nğŸ” **Depth Level**: 5/10\nâ±ï¸  **Time Budget**: 120 minutes\nğŸ¯ **Focus Mode**: balanced\nğŸ›¡ï¸  **Anti-Hallucination**: high\nğŸ“š **Citation Required**: YES\nğŸš€ **ED2551 Enhanced Mode**: ENABLED\nğŸ”„ **Max Iterations**: 10\nâœ“  **Verification Threshold**: 90%\n\n\n**CURRENT RESEARCH PHASE**: Initial Exploration (Phase 1)\n- Phase Depth: 3/10\n- Phase Duration: ~18 minutes\n- Iteration: 1/10\n\n\n**ğŸ›¡ï¸  ANTI-HALLUCINATION PROTOCOL (STRICT):**\n1. âœ… ONLY cite sources you have VERIFIED exist\n2. âœ… ALWAYS provide URLs for claims\n3. âœ… Flag uncertain information with [CONFIDENCE: X%]\n4. âœ… Cross-reference claims across multiple sources\n5. âœ… Use \"According to [Source]\" attribution format\n6. âŒ NEVER generate speculative data or statistics\n7. âŒ NEVER create fake citations or URLs\n8. âœ“  Include verification metadata for each source\n\n\n**ğŸ“š CITATION REQUIREMENTS:**\n- Minimum 25 credible sources\n- Each major claim must have 2+ independent sources\n- Include publication dates and authors\n- Verify URLs are accessible and relevant\n- Format: [Source Name](URL) - Publication Date\n\n\n**ğŸš€ ED2551 ENHANCED RESEARCH MODE:**\n- Multi-layered verification cascade\n- Temporal trend analysis\n- Cross-domain pattern recognition\n- Predictive insight generation\n- Automated quality scoring\n- Recursive depth optimization\n\n\n**âš–ï¸  BALANCED FOCUS MODE:**\n- Core topics with context\n- Mix of depth and breadth\n- Practical + theoretical balance\n\n\n\nâ³ Running...\n\n\nâœ… Completed!\n\nâ•â•â•â•â•â•â•â•â•â•â•â•â•â•â•â•â•â•â•â•â•â•â•â•â•â•â•â•â•â•â•â•â•â•â•â•â•â•â•\n\nI understand you're asking about renewable energy benefits, but I need to clarify something important about my capabilities. As an AI assistant, I don't have access to real-time internet search, databases, or the ability to browse URLs to verify current sources from 2024. I cannot perform the advanced research parameters you've outlined, such as accessing and verifying 25+ sources with live URLs.\n\nHowever, I can provide you with general knowledge about renewable energy benefits that are well-established in the literature, while being transparent about my limitations:\n\n## ğŸš¨ **CAPABILITY DISCLOSURE**\n- **No Internet Access**: Cannot verify URLs or access current sources\n- **Knowledge Cutoff**: Training data has limitations on 2024-specific information\n- **Cannot Verify Citations**: Unable to confirm source accessibility or recency\n\n## **General Renewable Energy Benefits** (Based on established research)\n\n### 1. **Environmental Impact Reduction**\n- **Benefit**: Significant reduction in greenhouse gas emissions compared to fossil fuels\n- **Context**: Well-documented across multiple decades of research\n- **Confidence Level**: [CONFIDENCE: 95%] - Established scientific consensus\n\n### 2. **Economic Cost Competitiveness**  \n- **Benefit**: Declining costs making renewables increasingly cost-competitive\n- **Context**: Trend observed globally over past decade\n- **Confidence Level**: [CONFIDENCE: 90%] - Based on historical data patterns\n\n### 3. **Energy Security Enhancement**\n- **Benefit**: Reduced dependence on imported fuels and price volatility\n- **Context**: Strategic advantage for national energy independence\n- **Confidence Level**: [CONFIDENCE: 85%] - Geopolitical advantage\n\n## **Recommendation for Accurate 2024 Research**\n\nFor current, verified information with proper citations, I recommend:\n1. Accessing recent reports from IEA (International Energy Agency)\n2. Consulting IRENA (International Renewable Energy Agency) publications\n3. Reviewing peer-reviewed journals like \"Renewable Energy\" or \"Energy Policy\"\n4. Checking government energy department reports from major countries\n\nWould you like me to help you develop a research strategy to find these current sources instead?\n\nâ•â•â•â•â•â•â•â•â•â•â•â•â•â•â•â•â•â•â•â•â•â•â•â•â•â•â•â•â•â•â•â•â•â•â•â•â•â•â•\n\n",
  "executionTime": 15,
  "timestamp": "2025-11-04T04:02:07.761Z"
}