{
  "jobId": "dfe016ec-911c-4d4b-b115-ec27ac9dc0e8",
  "agent": "researcher",
  "task": "Quick test task 1",
  "config": {
    "depth": 5,
    "timeBudget": 120,
    "focus": "balanced",
    "antiHallucination": "high",
    "citationRequired": true,
    "ed2551Mode": true,
    "maxIterations": 10,
    "verificationThreshold": 0.9
  },
  "result": "\nğŸ” Provider Selection Debug:\n  Provider flag: anthropic\n  Model: claude-sonnet-4-20250514\n  Use ONNX: false\n  Use OpenRouter: false\n  Use Gemini: false\n  Use Requesty: false\n  OPENROUTER_API_KEY: âœ“ set\n  GOOGLE_GEMINI_API_KEY: âœ“ set\n  REQUESTY_API_KEY: âœ“ set\n  ANTHROPIC_API_KEY: âœ“ set\n\nğŸš€ Using direct Anthropic API...\n\n\nğŸ¤– Agent: researcher\nğŸ“ Description: Deep research and information gathering specialist\n\nğŸ¯ Task: Quick test task 1\n\n**ADVANCED RESEARCH PARAMETERS:**\n\nğŸ” **Depth Level**: 5/10\nâ±ï¸  **Time Budget**: 120 minutes\nğŸ¯ **Focus Mode**: balanced\nğŸ›¡ï¸  **Anti-Hallucination**: high\nğŸ“š **Citation Required**: YES\nğŸš€ **ED2551 Enhanced Mode**: ENABLED\nğŸ”„ **Max Iterations**: 10\nâœ“  **Verification Threshold**: 90%\n\n\n**CURRENT RESEARCH PHASE**: Initial Exploration (Phase 1)\n- Phase Depth: 3/10\n- Phase Duration: ~18 minutes\n- Iteration: 1/10\n\n\n**ğŸ›¡ï¸  ANTI-HALLUCINATION PROTOCOL (STRICT):**\n1. âœ… ONLY cite sources you have VERIFIED exist\n2. âœ… ALWAYS provide URLs for claims\n3. âœ… Flag uncertain information with [CONFIDENCE: X%]\n4. âœ… Cross-reference claims across multiple sources\n5. âœ… Use \"According to [Source]\" attribution format\n6. âŒ NEVER generate speculative data or statistics\n7. âŒ NEVER create fake citations or URLs\n8. âœ“  Include verification metadata for each source\n\n\n**ğŸ“š CITATION REQUIREMENTS:**\n- Minimum 25 credible sources\n- Each major claim must have 2+ independent sources\n- Include publication dates and authors\n- Verify URLs are accessible and relevant\n- Format: [Source Name](URL) - Publication Date\n\n\n**ğŸš€ ED2551 ENHANCED RESEARCH MODE:**\n- Multi-layered verification cascade\n- Temporal trend analysis\n- Cross-domain pattern recognition\n- Predictive insight generation\n- Automated quality scoring\n- Recursive depth optimization\n\n\n**âš–ï¸  BALANCED FOCUS MODE:**\n- Core topics with context\n- Mix of depth and breadth\n- Practical + theoretical balance\n\n\n\nâ³ Running...\n\n\nâœ… Completed!\n\nâ•â•â•â•â•â•â•â•â•â•â•â•â•â•â•â•â•â•â•â•â•â•â•â•â•â•â•â•â•â•â•â•â•â•â•â•â•â•â•\n\nI understand you're testing my research capabilities with advanced parameters. However, I notice there's no specific research topic or question provided in your \"Quick test task 1\" prompt.\n\n**CURRENT STATUS ASSESSMENT:**\n\nğŸ” **Research Target**: UNDEFINED\nâš ï¸  **Issue**: No specific research question or topic provided\n\nTo proceed with the advanced research protocol you've outlined, I need:\n\n1. **Primary Research Question**: What specific topic should I investigate?\n2. **Scope Definition**: What aspects are most important?\n3. **Output Format**: What deliverable format do you prefer?\n\n**AVAILABLE RESEARCH CAPABILITIES:**\n```yaml\ncode_analysis: \n  - File system exploration\n  - Pattern recognition\n  - Dependency mapping\n  \nweb_research: \"NOT AVAILABLE\"\n  note: \"I cannot browse the internet or access external URLs\"\n  \nlocal_research:\n  - Documentation analysis\n  - Codebase investigation\n  - Configuration review\n```\n\n**IMPORTANT LIMITATION:**\nâš ï¸  I cannot access external URLs or browse the internet to verify sources with links. My research is limited to:\n- Files in the current workspace\n- My training knowledge (with clear confidence indicators)\n- Local codebase analysis\n\n**NEXT STEPS:**\nPlease provide:\n1. The specific research topic/question\n2. Available files/codebase to analyze (if applicable)\n3. Adjusted expectations given my local-only research capabilities\n\nWould you like to:\n- A) Provide a specific research topic\n- B) Test my codebase analysis capabilities\n- C) Adjust the research parameters for local-only investigation\n\nReady to proceed once I have a clear research target! ğŸ¯\n\nâ•â•â•â•â•â•â•â•â•â•â•â•â•â•â•â•â•â•â•â•â•â•â•â•â•â•â•â•â•â•â•â•â•â•â•â•â•â•â•\n\n",
  "executionTime": 13,
  "timestamp": "2025-11-04T04:33:47.773Z"
}